id,example,term,pos,sense_id,definition,ANNOTATION,DEFICIENT SENTENCE
1628,It is incontestably the case that future generations enjoyed the extraordinary fruits of the Industrial Revolution’s “great enrichment”.,fruit,noun,3,"An end result, effect, or consequence; advantageous or disadvantageous result.",,
2378,"My sister read the Deborah Jackson book when she was pregnant. She was enchanted, being a full-on lentil-weaver.",lentil-weaver,noun,1,"A left-wing, environmentalist or hippie person.",,
2732,"[S]hall I be call'd as many blockheads, numſculs, doddypoles, dunderheads, ninnyhammers, gooſecaps, joltheads, nicompoops, and ſ—t-a-beds—and other unſavory appelations,  […]",nincompoop,noun,1,A foolish or silly person. [from 16th c.],,
1061,"Shut up, dicksucker. Nobody likes you.",dicksucker,noun,2,Term of abuse.,,
1829,"Regarding this human angle, DeMille wrote, ""I am sometimes accused of gingering up the Bible with large and lavish infusions of sex and violence. I can only wonder if my accusers have ever read certain parts of the Bible.""",ginger,verb,2,"To enliven, to spice (up).",,
2268,"The creeks gave us lots of food, too—yellow belly and jew, perch and eel.",jew,noun,1,The jewfish. [from 19th c.],,
2698,"“Well, needle dick isn't going to be able to service you. Maybe I'll bring my brother in here. He's got a nice, man-sized prick. We could fuck both your holes at the same time.”",needle dick,noun,2,A man with a tiny penis; usually used as a disparaging form of address.,,
187,"OK, I'm pissed. Those record company bastiches who decide what songs go on what albums and cds. The Live After Death cd would be awsome if the mother fuckers at capitol would have left all of the songs on it.",bastich,noun,1,An obnoxious or contemptible person.,,
2836,"Padock calls anon: faire is foule, and foule is faire, / Houer through the fogge and filthie ayre.“Padock” is a spirit in the shape of a toad. ",paddock,noun,3,"A frog; A toad; A contemptible, or malicious or nasty, person. ",,
2756,Be jovial but not a comedian. We have a sense of humor that the normies don't have.,normie,noun,1,"A normal person; one with commonly held, normative beliefs, neurology, tastes or interests.",,
2598,I think it was the Fourth of July when they took the chair from under my ass again. Not a word of warning. One of the big muckamucks from the other side of the water had decided to make economies;  […],muckamuck,noun,1,"A person in a position of power or authority, or of high status.",,
1832,"There he is, moving in his best form, with the full knowledge that that long whip in his rear will once more be round his flanks, as it has often been before, if he fails to wake up when he comes out for a show—well gingered, too, we should say, and all life and action.",ginger,verb,3,To apply ginger to the anus of a horse to encourage it to carry its tail high and move in a lively fashion.,,
117,"Two young giants with smooth, baby faces—two Scandinavians—helped each other to spread their bedding, silent, and smiling placidly at the tempest of good-humoured and meaningless curses.",baby face,noun,1,"A face, often chubby, resembling that of a baby; a youthful face.",,
4289,Professional gamblers have a cushy racket in college football because old grads and even townies of college localities are sentimental bettors and easy to separate from their money.,townie,noun,1,A person living in a university area who is not associated with the university.,,
3557,"He'll take himself down.Yeah, history always proves that, right? Just wait for justice, you sheeple…",sheeple,noun,1,People who unquestioningly accept as true whatever their political leaders say or who adopt popular opinion as their own without scrutiny.,,
1038,The slow cinema verite pacing of this film suited it's totally depressoid theme.,depressoid,adjective,2,Depressing or miserable.,,
4187,"A federal balanced budget sounds good in political speeches, but in reality the idea is simply a taxocrat's dream, as it would become a constitutional order to cover all spending, even the unnecessary, deficit kind.",taxocrat,noun,1,A politician or bureaucrat supporting excessive taxes or spending.,,
846,The sight made my flesh creep.,creep,verb,8,To have a sensation as of insects creeping on the skin of the body; to crawl.,,
1749,"Then believe it or not, I worked for some time as a garbo, collecting the rubbish in the wee hours of the morning.",garbo,noun,1,A rubbish collector; a garbage man.,,
2965,"The object of such an aesthetic education is not the creation of a society of aesthetes. Aesthetes, in that pejorative sense, are as unbalanced as philistines.",philistine,noun,1,"A person who is ignorant or uneducated; specifically, a person who lacks appreciation of or is antagonistic towards art or culture, and who has pedestrian tastes.",,
3101,"Even now, in the spring, the river softly cries, 'Menthol, Menthol, you are one wazoo. One day I'm the elf next door and the poof I'm a river.'",poof,interjection,1,"Onomatopoeia indicating a small explosion with a cloud of smoke; as caused by a deflating object, or a magical disappearance.",,
1175,drudge work,drudge,noun,1,A person who works in a low servile job.,,
1990,"[L]ike many model train enthusiasts, he now takes some pride in being called a foamer, or a gunzel, or even a gricer – all names for those who enjoy model trains.",gunzel,noun,1,A railway or tram enthusiast; particularly (formerly derogatory) one who is overly enthusiastic or foolish.,,
2076,Say that you’d only just got used to telling your friends your daughter was a lesbian and do not relish having to inform them that she is now a hasbian.,hasbian,noun,1,A woman who formerly identified as lesbian but now identifies as heterosexual or bisexual.,,
1142,"However, sensing the available traction may actually be more important to a drifter.",drifter,noun,3,A driver who uses driving techniques to modify vehicle traction to cause a vehicle to slide or power slide rather than drive in line with the tires.,,
615,"But despite their seemingly rampant Anglophilia, there are still some things the French miss—a good steak tartare, for instance, or the chance to cheer on their rugby team without being shouted down as ‘cheese-eating surrender monkeys’.",cheese-eating surrender monkey,noun,1,A French person.,,
823,"Likewise, early software pirates and ""crackers"" often used phrases like ""information wants to be free"" to protest the regulations against the copying of proprietary software packages and computer systems.",cracker,noun,9,One who cracks (i.e. overcomes) computer software or security restrictions.,,
180,"Of what race could these people be? Their language was a bastard Arabic, and yet they were not Arabs; I was quite sure of that.",bastard,adjective,4,"Of abnormal, irregular or otherwise inferior qualities (size, shape etc).",,
665,It shouldn't be hard to put one over on that chump.,chump,noun,2,A gullible person; a sucker; someone easily taken advantage of; someone lacking common sense.,,
2271,"[…]  while it is our frivolity, our rottenness and our vices, inculcated by us and copied from us, that these Hebraiculi, these degenerate Jewlings, are practising for the sake of our pleasure or their own profit.",Jewling,noun,1,A young or petty Jew.,,
4225,"I shall keep my eye open, and the first pretty little tit I see that I think will suit you, I shall make the guv'nor buy.",tit,noun,8,A small horse; a nag.,,
1980,> If ...you actually stopped infesting foreign newsgroups with your gunfucker phantasms....if only.,gunfucker,noun,1,A person obsessed with owning guns; a zealous supporter of the right to bear arms.,,
1892,That patient is a total GOMER. Turf him and let's get some lunch.,gomer,noun,6,"An undesirable hospital patient, or a patient who does not need medical care.",,
1049,"private dick, railroad dick",dick,noun,7,A detective.,,
3286,Sealed cells with about to emerge queens are used for queening the divisions.,queen,verb,5,To provide with a new queen bee.,,
3941,a square of glass,square,noun,2,"Something characterized by a square, or nearly square, form.",,
3666,You say you were knocked silly—was that so?,silly,adjective,5,"Mentally simple, foolish, particularly:",,
3360,"This, again, is classic Red Fascist thought. The People cannot think for themselves, and need people like Carrick to do their thinking for them.",red fascist,noun,1,A communist.,,
4049,"""I don't hold back like you do.  Even Tedd's dad can tell you're a stick in the mud.  That's why he made you the supervisor of this party.""",stick in the mud,noun,1,A person unwilling to participate in activities; a curmudgeon or party pooper.,,
1680,"He leaned back suddenly, burying his fuckstick up to the hilt. He came with a long, loud grunt. I felt the underside of his shaft throb as he bathed the walls of my aching rectum with his dickjuice.",fuckstick,noun,1,penis,,
4587,I came out in an alley where a couple of winos were picking through a trash bin.,wino,noun,1,A chronic or heavy drinker of cheap wine or other alcohol; a drunk or drunkard.,,
1942,"All eye turned to the small jewel of a bird that was sipping nectar from an orange-flowered plant. ""A greenie, I think, Rose,"" said Hilary Fotherington-Thomas, squinting down her binoculars.",greenie,noun,7,Any of various birds having predominantly green plumage.,,
3537,Your profession always charges high and never guarantees their work. No sellsword would stay alive if he demanded a sorcerer's terms.,sellsword,noun,1,A mercenary.,,
1260,"Thus time paſſing on, within a yeere following, which was in the yeere of our Lord 1261. the king [Henry III of England] ſeeing himſelfe more and more to grow in debt, and not to bee relieued according to promiſe made, but eſpecially being egged  by his brethren taking it to ſtomach, ſent vp to the pope, both for him and his ſonne Edward to bee releaſed of their oth made before at Oxford.",egg,verb,5,"To encourage, incite, or urge (someone).",,
671,"“Jeremy? Hardly my friend. As you said yourself, an overbearing lackey, not to mention a flaming chutney ferret.”",chutney ferret,noun,1,A homosexual man.,,
236,"The terms ""Blue Light,"" ""Holy Joe"" and ""Bible Thumper"" began to lose some of their venom ; religion in the army was respected.",Bible thumper,noun,1,A Christian fundamentalist or overzealous evangelical Christian.,,
4488,"Fuck you, limey wanktard.",wanktard,noun,1,An obnoxious or contemptible person.,,
681,"wadi let me guess, you're a circumfetishist? You like the idea of some poor bastard getting circumcised.",circumfetishist,noun,1,A person with a sexual fetish for male circumcision.,,
3516,"""Maybe they weren't screwing, my dear. They were just hanging out, you know."" ""They were screwing, my dear.""",screw,verb,2,To have sexual intercourse with.,,
3428,"Scab was the terror of the sheep farmer, and the peril of his calling.",scab,noun,3,"The mange, especially when it appears on sheep.",,
605,"You'll notice a common cause among all international liberals--the sheep fucker in Australia , the cheese monkey in France, John Kerry--they're all together somehow, all operating along similar lines of force. Is it love of America that unites them? No? Then what is it?",cheese monkey,noun,1,A French person.,,
66,They made puir Robbie Burns an anythingarian with their blethers.,anythingarian,noun,1,A person who does not profess any particular creed; an indifferentist.,,
2282,"Everyone knows a jobsworth. They are in our offices: the keeper of the stationery cupboard and the grumpy security guard. They add crucial extra minutes to the daily commute: the traffic warden who stands waiting for the time to tick over, the bus driver who drives past as you sprint for the bus stop.",jobsworth,noun,1,A minor official or worker who refuses to be flexible in the application of rules to help a client or customer.,,
1516,"Monique whispered something to a butch sitting near her. The butch crossed the room and approached our table. “Hey,” she called to me. I didn't look up. “Hey, femme, you wanna dance with a real butch?”",femme,noun,2,"A lesbian or other queer woman whose appearance, identity etc. is seen as feminine as opposed to butch. [from 20th c.]",,
6,"The quack abortionist, with “a little knowledge,” impudently, remorselessly, and secretly employs his craft for filthy lucre’s sake, perpetrating one crime to conceal another, at which science and charity blush.",abortionist,noun,1,"A person who performs abortions, especially illegally or secretly. [from 1844]",,
4515,"The program also can shatter once and for all that ""welfare bum"" myth that has served as an excuse to avoid obligation and sacrifice to aid unfortunate people.",welfare bum,noun,1,"A person whose source of income is government public assistance payments, especially one who is lazy and unwilling to work.",,
4563,Is there any distinction between a nation that whores after a golden calf and one that whores after a black Cadillac?,whore,verb,6,To pursue false goals.,,
3169,"""It's your fault, pukeface!""",pukeface,noun,1,"A contemptible, undesirable, or ugly person.",,
3527,"But maybe she'd just got scunnered with Glasgow, fucked off to try her luck someplace else.",scunner,verb,3,"To cause to loathe, or feel disgust at.",,
3792,"To hear her rant, one would have supposed, who had not seen him, that her lank-haired, grimly partner, was the prettiest youth in the county of Dublin, and that all the comely lasses in Chapelizod and the country round were sighing and setting caps at him; and Devereux, who had a vein of satire, and loved even farce, enjoyed the heroics of the fat old slut.",slut,noun,6,"A bold, outspoken woman.",,
4137,"Breakfast was taken alongside a curious tank without a turret. When I asked about it a tankie sergeant said, 'It's a Kangaroo: that's a Sherman without a turret. The Canadians make them. […]'",tankie,noun,3,A soldier from a tank regiment.,,
473,You're a bum / You're a punk / You're an old slut on junk / Lying there almost dead on a drip in that bed,bum,noun,4,"A lazy, incompetent, or annoying person, usually a man.",,
3635,"I remember, before the Dwarf left the Queen, he followed us one day into thoſe gardens, and my Nurſe having ſet me down, he and I being cloſe together, near ſome Dwarf Apple trees, I muſt need ſhew my Wit, by a ſilly Alluſion between him and the Trees, which happens to hold in their Language as it doth in ours.",silly,adjective,1,Laughable or amusing through foolishness or a foolish appearance.,,
362,A Hottentot... expects to be called by his name if addressed by any one who knows it; and by those to whom it is not known he expects to be called Hottentot... or boy.,boy,noun,6,"Any non-white male, regardless of age. [from 19th c.]",,
3620,"The conservative Boston Herald, which had earlier described the revelations about Barney′s two-year relationship with a male prostitute as “one of the most tawdry episodes in modern Massachusetts politics” and had run a story by the columnist Howie Carr calling Frank “a sicko who happens to be a pol,” urged him to resign his house seat.",sicko,noun,1,"A person with unpleasant tastes, views or habits.",,
3819,"We were playing in Dallas, when that snake in the grass—Eight Ball, everyone called him—came up on my blind side …",snake in the grass,noun,1,A hidden enemy.,,
268,You and Sin? A blindie and a loudmouth who doesn't ever do anything right?,blindie,noun,1,A blind person.,,
437,"Election work and party involvement is increasingly seen as the unhip, uncool, morally compromised province of social climbers and “brogressives” not truly committed to the supposedly “real work” of social justice engagement by non-electoral means.",brogressive,noun,1,"A male progressive, socialist, or leftist who downplays women's issues or displays a macho or patriarchal attitude.",,
302,"Polish Joe was a bogger, a man who shifted unbelievable quantities of dirt away from the face from which it had been blown, and into trucks for dumping in the underground bins each day.",bogger,noun,5,Someone who works to shovel ore or waste rock underground.,,
1425,to be without fellow    to have no fellows,fellow,noun,4,"A person or thing comparable in characteristics with another person or thing; especially, as belonging to the same class or group.",,
2219,Jackeens loitering about the Dublin theatres.,jackeen,noun,1,"An arrogant lower-class person, especially in Dublin.",,
1178,"Loganlea, where Rosleigh's five children grew up, is a battler's zone at the far south of Brisbane. According to James, a place you just want to get out of. ""There's heaps of trouble around this area. Armed robberies, heaps of druggos.  […]",druggo,noun,1,"A user of illicit drugs, a druggie.",,
2438,A 'lot lizard' was somebody who walked the sales lot and looked at every car and still didn't buy.,lot lizard,noun,5,A customer at an automobile dealership to whom a vehicle is difficult to sell.,,
157,Hearing Sir Fred the Shred and the rest of them utter some hedged half-apologies has not made the public feel any warmer to the banksters.,bankster,noun,1,"A banker who is seen as criminally irresponsible, or as extorting bailout money from the taxpayers.",,
4081,"RAMSAY: Dave, can you land this sucker?",sucker,noun,19,Any thing or object.,,
2166,The club was full of eager young hotheads who never seemed to be able to agree on anything.,hothead,noun,1,One who angers easily or goes in search of arguments or fights.,,
3924,The hunters were spooked when the black cat crossed their path. The movement in the bushes spooked the deer and they ran.,spook,verb,1,To frighten or make nervous (especially by startling).,,
4237,"Where I come from, the word ‘reptile’ is a term of endearment, used in much the same way as ‘toe rag’ or ‘moosh’.",toe rag,noun,1,A tramp.,,
411,"The number of souls in this kingdom being usually reckoned one million and a half, of these I calculate there may be about two hundred thousand couple whose wives are breeders; from which number I subtract thirty thousand couples who are able to maintain their own children, although I apprehend there cannot be so many, under the present distresses of the kingdom; but this being granted, there will remain an hundred and seventy thousand breeders.",breeder,noun,4,A person who has had or who is capable of having children; a person who is focussed on the rearing of their own children.,,
975,"So being outlaw'd , / He with a crew went forth / Of lusty cutters, bold and strong, / And robbed in the north.",cutter,noun,13,A ruffian; a bravo; a destroyer.,,
981,[…] swing my cutterGet man down if he is on my brother,cutter,noun,17,A knife.,,
1608,Is this a time for fooling?,fool,verb,2,To act in an idiotic manner; to act foolishly.,,
1983,The problem is that these NRA gunloons don't believe that they also have the *duty* to own them *responsibly.*,gunloon,noun,1,A person obsessed with owning guns; a zealous supporter of the right to bear arms.,,
4162,"From the follovving Dye are Compoſed the beſt Tavvnies, Grey and Crimſon Goat Colours.  […]  The Silk muſt be put in vvhen the Suds are cold, for the colder the Suds, the blevver the Violet Colour, vvhich muſt alvvays be blevver than the Tavvnies.",tawny,noun,1,A light brown to brownish orange colour.,,
4478,"I've written a lot and looking back, I wonder why I wrote all this . So let's just end off with this: hire me plz.",wagecuck,noun,1,"A person who works a mindless, low-paying job.",,
413,"What is this here natural/unnatural stuff, anyway? Seems like a rationalization to this breeder.",breeder,noun,5,A heterosexual; i.e. one whose sexual intercourse can lead to breeding.,,
653,"Cya in Vegas ya tow truck facker!I already floored one choadsucker in the last couple of days. You wanna be next?!Haha! I'll kick ya sorry ass, Ya buttsore sober asslickin freak!",choadsucker,noun,1,A term of abuse.,,
2910,It will be necessary to continually monitor the holes for voids and the plating for peelers -- but this is a good idea for any plating operation which uses dry film photoresist.,peeler,noun,5,"Something that is peeling, about to peel, or prone to peeling.",,
341,"It takes on faith a heterogeneous, bourgie morality and gives the lie that tween girls – or, more accurately, their movie-ticket-buying parents – want to hear.",bourgie,adjective,1,Alternative form of bougie.,,
1688,Forgetting our anniversary was a major fuckup.,fuckup,noun,1,A serious mistake.,,
3181,"Because he was so weak, Vinny soon became Tony's punk.",punk,noun,1,"A person used for sex, particularly:",,
3748,"‘ […] He was a lovely man but, when I told him I wanted to continue swinging, he freaked out and called me a slag.’",slag,noun,6,A prostitute or promiscuous woman; a slut.,,
3198,"Babbitt boomed on: ""Pretty punk service the Company giving us on these car-lines. Nonsense to only run the Portland Road cars once every seven minutes. Fellow gets mighty cold on a winter morning, waiting on a street corner with the wind nipping at his ankles.""",punk,adjective,1,"Worthless, contemptible, particularly [1907]",,
426,"This being so, we may note that foreigners who disliked our long-haired kings no only insulted them by calling them the 'bristled ones' butals said their bristles were a thing they had in common with lions, horses and swine , and they even extended the insult by saying they had pig's bristles.",bristler,noun,2,A bristled pig.,,
17,some 'ah neh' stole my hp! not tt i'm a racist but i saw this indian or dunno bhangra walking near me on the way to the mrt stn and din realise tt i lost my hp till i got on the train at jurong east to look for it.,ah neh,noun,1,"An Indian man, especially a migrant worker.",,
1194,dwarf tree,dwarf,noun,3,"An animal, plant or other thing much smaller than the usual of its sort.",,
444,To divert the audience with buffoon postures and antic dances.,buffoon,noun,1,One who acts in a silly or ridiculous fashion; a clown or fool.,,
2588,"English, motherfucker, do you speak it?",motherfucker,noun,1,An extremely contemptible or mean person.,,
2942,"“When's the last time I asked you to do anything for me, pencil dick?”",pencil dick,noun,2,A man with a penis of inadequate girth.,,
3655,To doe the thing we canTo please...This silly sickly man.,silly,adjective,3,"Pitiful, inspiring compassion, particularly:",,
754,The commies claim they are helping the blacks.,commie,noun,1,A communist; a person with communist sympathies; a supposed communist infiltrator.,,
3233,"The advertising quack who wearies / With tales of countless cures, / His teeth, I've enacted, / Shall all be extracted / By terrified amateurs.",quack,noun,2,"A fraudulent healer, especially a bombastic peddler in worthless treatments, a doctor who makes false diagnoses for monetary benefit, or an untrained or poorly trained doctor who uses fraudulent credentials to attract patients [from c. 1630]",,
2853,A royalist who publicly called for a military intervention to protect the parasite monarchy.,parasite,noun,1,A person who lives on other people's efforts or expense and gives little or nothing back. [from 16th c.],,
2995,There will be no pictures of pigs shooting down brothers on the instant replay,pig,noun,9,A police officer. [From ante 1785.],,
4583,"[…]  ""we're being maneuvered into providing a gala State funeral for that reprobate winesop.""",winesop,noun,2,"A drunkard, a wino.",,
4050,"There’s a parallel here: the idea of Barbie dolls being in any way noxious seems, in the current climate, to be as hopelessly stick in the mud a stance as the concept of selling out.",stick in the mud,noun,2,"More generally, one who is slow, old-fashioned, or unprogressive; an old fogey.",,
1836,"Spring training began on Christmas Day, when my cousin and I gingered onto the lot behind the fire station to try out our new spikes.",ginger,verb,5,"To move gingerly, in a very careful and cautious manner.",,
3349,"Indeed, Julia Eileen Gillard may not even be the country′s first ranga prime minister; since all the old ones appear only in black and white, we can′t tell.",ranga,noun,1,An orange-haired or red-haired person.,,
3153,"The inclusion not only of [Michael I] Cerularius, but of all his followers, and the denunciation of the Greeks as prozymite heretics, does look like a condemnation of the whole Byzantine church until it should change its practices.",prozymite,noun,1,"One who administers the Eucharist with leavened bread, in particular a member of the Eastern Orthodox Church. [from mid 19th c.]",,
1673,You really can't come to grips with the reality that people are all coming to the realization independently that you and your little crew are fucknozzles. You also can't handle that we deal with you as individuals and don't have a central authority guiding us. Must be a real bitch for you to be a wannabe super netcop-netnanny and no hope in hell of accomplishing it.,fucknozzle,noun,1,An obnoxious or contemptible person.,,
587,"The political cartoon showed the politician as a caveman, clubbing the budget depicted as a mammoth.",caveman,noun,1,"An early human or closely related species, popularly held to reside in caves.",,
363,"Every darky, however old, is a boy.",boy,noun,6,"Any non-white male, regardless of age. [from 19th c.]",,
4123,His reputation was ruined when it was revealed that he had been a Nazi sympathizer before the war.,sympathizer,noun,1,"A person who sympathizes (with a political cause, a side in a conflict, etc.); a supporter.",,
4567,"Upon checking it out, we found a total of 13 newborn wildcats: nine newborn tigers and two newborn leopards.",wildcat,noun,1,"A cat that lives in the wilderness, specifically",,
3218,"And although, as someone recently said to me, they are not ""designer"" , to me my cats are the most beautiful in the world.",pussy,noun,1,A cat. [from 17th c.],,
