id,example,term,pos,sense_id,definition,ANNOTATION,DEFICIENT SENTENCE
2964,"In politics this type of philistine has more than once denounced the ""golden rule"" as an ""iridescent dream"" of a lunatic. Such philistinism pleases the misoneism of the mediocre, whence the enthusiasm over platitudes and the reign of the philistine in newspaper art, literature and science.",philistine,noun,1,"A person who is ignorant or uneducated; specifically, a person who lacks appreciation of or is antagonistic towards art or culture, and who has pedestrian tastes.",,
2774,The doctor told me I was a little obeast.,obeast,noun,1,A very obese or overweight person.,,
1001,"SHE is one of Hollywood's most beautiful leading ladies and has access to any fashion designers, so then why is Catherine Zeta-Jones dressing like a bag lady?",dag,noun,8,One who dresses unfashionably or without apparent care about appearance; someone who is not cool; a dweeb or nerd.,,
3590,"[…]  a job that dealt with an endless parade of shitskin losers—hunting them down, befriending them in order to get their confessions, then tossing them into County  […]",shitskin,noun,1,A person with dark-coloured skin.,,
1076,And Chester Charles Smithers sucked on that warm black dingus for as long as he could.,dingus,noun,3,penis,,
1412,"Carried somehow, somewhither, for some reason, on these surging floods, were these travelers, of errand not wholly obvious to their fellows, yet of such sort as to call into query alike the nature of their errand and their own relations.",fellow,noun,1,A companion; a comrade.,,
213,There is another type from Siemens which is the HYB 39S64XXX -8B version  which is totally beast altogether.,beast,adjective,1,great; excellent; powerful,,
132,"There is a strong trans sapphic and transfem4transfem trend within bæddel circles, though I wouldn’t say that romantic interest in fellow transfems is a requirement of claiming the term. Merely a personal prioritising of transfems in relationships, platonic or otherwise, as well as with one’s politics.",bæddel,noun,1,"A transgender woman or transfeminine individual, especially one who holds that transgender individuals to whom transmisogyny does not apply (chiefly transmasculine and non-binary individuals who were assigned female at birth, who are TME or ""transmisogyny-exempt"") are capable of utilizing, exploiting, or otherwise benefiting from transmisogyny.",,
1780,it’s funny when a gendie tells me to go outside as if people outside believes in infinite genders and males becoming women,gendie,noun,1,A person who is deeply invested in novel gender identities and the subversion of traditional gender ideology.,,
2803,"If the children are at home, the front yard, creeping unsodded from beneath the porch, is naked and clean. If the children are grown ..., verbena, old maids [zinnias], phlox, and four-o'clocks, crowd each together for space",old maid,noun,3,The common zinnia.,,
1786,"And when their ſcattered armie is ſubdu’d:And you march on their ſlaughtered carkaſſes,Share equally the gold that bought their liues,And liue like Gentlmen in Perſea,  […]",gentleman,noun,1,"A man of gentle but not noble birth, particularly a man of means (originally ownership of property) who does not work for a living but has no official status in a peerage; (UK law) an armiferous man ranking below a knight.",,
1563,"Earlier we gave the example of a plane taking off in the third dimension apparently disappearing from the view of a two-dimensional flatlander; analogously, particles appearing from the fifth dimension, or disappearing into it, could be a signal at the LHC that space-time is indeed, like Emmenthal cheese, permeated with little bubbles which are at the edge of our present abilities to measure.",flatlander,noun,2,An inhabitant of or observer in a universe with two spatial dimensions.,,
1157,"The government had been slowly running down the Royal Navy Organisation to save money on various peoples' budgets, so now we had to sub-contract ships to go to war! So stop dripping and ""make it so"", all those admirals can't be wrong!",drip,verb,7,To whine or complain consistently; to grumble.,,
3508,"A certain amount of ""screw"" is as necessary for a man as for a billiard-ball.",screw,noun,8,"Salary, wages.",,
192,And from each other look thou lead them thusTill o'er their brows death-counterfeiting sleepWith leaden legs and batty wings doth creep.,batty,adjective,2,"Belonging to, or resembling, a bat (mammal).",,
3496,"And that's how it came to pass that on the second-to-last day of the job, the convict crew that tarred the plate factory roof in the spring of forty-nine wound up sitting in a row at ten o'clock in the morning drinking icy cold, Bohemia-style beer, courtesy of the hardest screw that ever walked a turn at Shawshank State Prison.",screw,noun,3,A prison guard.,,
2963,"""Oh, the Philistine! The boorish Philistine!"" he murmured; [...]",philistine,noun,1,"A person who is ignorant or uneducated; specifically, a person who lacks appreciation of or is antagonistic towards art or culture, and who has pedestrian tastes.",,
80,"I even had the balls to hit Barneys, which actually wasn't that remarkable since, the way I look, it's hard to tell if I'm some deliberately disheveled successful artfuck or just a down-and-out guy,  […]",artfuck,noun,1,A pretentious artist or person interested in the arts.,,
4348,"It documented literary, cross-cultural, cross-historical and scientific studies on same-sex love and transgender.",transgender,noun,2,Transgenderism; the state of being transgender. (Compare transsex.),,
559,"But, ere one rapid moon its tale has told, / He finds his prize — a cat — a slut — a scold.",cat,noun,3,A person:,,
2541,"He also said that minks, muskrats, foxes, coons, and wild mice were found there, but no squirrels.",mink,noun,1,"Any of various semi-aquatic, carnivorous mammals in the Mustelinae subfamily, similar to weasels, with dark fur, native to Europe and America, of which two species in different genera are extant: the American mink (Neovison vison) and the European mink (Mustela lutreola).",,
4212,We're not just talking about changes that tinker around the edges - we're looking to take advantage of some of the world's latest digital and tech developments to improve our service.,tinker,verb,2,"To fiddle with something in an attempt to fix, mend or improve it, especially in an experimental or unskilled manner.",,
1318,"A lot of rather etiolated, epicene, middle-class, male intellectuals have discovered a new authenticity when they come to identify themselves as football fans.",epicene,adjective,6,Of a man: effeminate.,,
4373,Everyone was a hon back then and trooning at that age still guarantees that you'll be a hon.,troon,verb,1,Synonym of troon out (“to undergo gender transition”),,
4246,"Look, if you got a toe-tapper in the stall next to yourself, just run.",toe-tapper,noun,3,"A homosexual who is closeted regarding sexual orientation, especially one who solicits gay sex. [from 2007]",,
1904,"[Jeremy Hunt] is charming, thoughtful and amusing in private, and one ally said he was ""almost a goody two shoes"".",goody two shoes,noun,1,A goody-goody; a person who is exceptionally good and perhaps self-satisfied.,,
1525,Her style was more femme than butch.,femme,adjective,3,Characteristic of a feminine lesbian or queer woman. [from 20th c.],,
2503,I seemed to attract old flower children and new age holistic eastern mystic 'mashuganas' .,mashugana,noun,2,A person who is silly or crazy; a jackass.,,
3707,"Excellent read  […]  The patronising and angst-ridden logic of old conservatives has become mainstream, leftish and 'radical'.",SJW,noun,1,Initialism of social justice warrior.,,
3066,"Completely absent was any mention of the Apple Watch Edition branding, which Apple used last year to launch a pair of $10,000-and-up Apple Watches that worked the same way as the cheap ones but were made out of actual gold instead of workaday, plebeian metals.",plebeian,adjective,3,"Common, particularly (derogatory) vulgar, crude, coarse, uncultured.",,
2758,"The split from Pauling, and the death of Laurelee, sent Robinson hurtling further out into the fringe, where he found a small but ardent caucus of contrarians: scientists, like him, who had abandoned — or been ejected from — the normie, left-leaning research community and who made common cause in puncturing prevailing views on smoking, DDT, radiation, depletion of the ozone hole and changes to the climate.",normie,adjective,1,Like a normal person.,,
3119,"She was now one of a group of oriental beauties who, in the second act of the comic opera, were paraded by the vizier before the new potentate as the treasures of his harem.",potentate,noun,1,A powerful leader; a monarch; a ruler.,,
1987,"My question concerns the significance to Midwestern guntards of their guns vs. their barns. It is a topic I've researched extensively, yet there seems to be a lack of definitive evidence to conclude which of the two is considered more important from the point of view of a guntard.",guntard,noun,1,A person obsessed with owning guns; a zealous supporter of the right to bear arms.,,
3714,It's also my job to take care of the skanks on the road that you bang.,skank,noun,1,"A lewd and disreputable person, often female, especially an unattractive person with an air of tawdry promiscuity.",,
392,Whicħ þat þey myght / wrape hem in at nyght / And a brat / to walk in / by day-light,brat,noun,3,A rough cloak or ragged garment.,,
973,After I got out of the mental institution I was looking at t.v. show I was looking it a teenage girl who was a cutter her arm look just like my arm.,cutter,noun,9,A person who practices self-injury by making cuts in the flesh.,,
657,"what we have here is a simple case of discrimination against a genetically defined group with a specific genetically defined sexual preference, like, the christfags did against gays a couple of years earlier.",christfag,noun,1,An overzealous Christian.,,
84,"1977 CHiPs 3 3/4"" action figures  $10-15 each",asshat,noun,1,An obnoxiously ignorant person; a fool.,,
1575,"Fluffy Bunny, Mary, is a game where you stuff marshmallows into your mouth, and say 'Fluffy Bunny.' The person who can stuff the most marshmallows in their mouth and still say 'Fluffy Bunny' wins.",fluffy bunny,noun,2,Synonym of chubby bunny (“competitive eating game”),,
3332,"There was already a crack for it on the warez BBSs but half the fun of a computer game is trying to crack it yourself. I guessed the ChatNetters were right, I was a r0dent.",r0dent,noun,1,"A person lacking in maturity, social skills, technical competence or intelligence; lamer. [mid 1980s-mid 1990s]",,
3852,That miserable so-and-so messed up my work!,so-and-so,noun,2,"Used in place of epithets such as SOB, bastard, etc.",,
74,"While its more sober counterpart was directed to quite different ends by a pugnacious aquabib, William Henry Draper",aquabib,noun,1,A teetotaler; one who does not consume alcohol.,,
4468,"My ex wife's a bit of a village bike, does that count? :-P",village bike,noun,1,A local woman who is sexually promiscuous.,,
2063,"It was at Para also that we engaged Gomez and Manuel, two half-breeds from up the river, just come down with a cargo of redwood.",half-breed,noun,1,"A person of mixed racial parentage or ancestry, especially one of mixed white and American Indian parentage (metis, métis, Metis, Métis; mestizo).",,
83,"the same connotations as ""FUCKWITS."" for less extreme cases i suggest ASSHATS",asshat,noun,1,An obnoxiously ignorant person; a fool.,,
2892,"Special Irish Branch was looking for Fenians in South Kensington; going from there to a Catholic church for Easter Mass was very nearly the stupidest thing Eliza could do, short of walking into Scotland Yard and cursing the peelers out in Irish.",peeler,noun,1,A police officer.,,
976,"He's out of cash, and thou know'st by cutter's law, / We are bound to relieve one another.",cutter,noun,13,A ruffian; a bravo; a destroyer.,,
2788,The slug they dug out of him was a .22. A woman's gun? Or was I being a sexist oinker?,oinker,noun,5,An MCP; male chauvinist pig.,,
4088,"We prefer to plant in rows instead of hills because the plants sucker so badly here, and because, with our scanty rainfall, it is better to have the plants isolated than bunched.",sucker,verb,2,To produce suckers; to throw up additional stems or shoots.,,
1716,Woe to the lad / without a rowen-tree gad.,gad,noun,4,"A rod or stick, such as a fishing rod or a measuring rod.",,
1511,These establishments serve as headquarters for covens of feminoids primarily to pursue their own agendas and only secondarily to help these alleged victims.,feminoid,noun,1,A feminist.,,
2522,"If Bach had any guts, he wouldn't take that. He's too much of a Milquetoast guy.",milquetoast,adjective,1,"Meek, timid; lacking character or effectiveness.",,
964,"“No shit, Cuntzilla. Did they close The Marketplace early because of the weather?”",cuntzilla,noun,1,A severely disagreeable or aggressive woman.,,
2112,"I think that 20 to 30 years ago nonfundamentalists in America did make a great mistake by typing them, by hillbillying and backwoodsing and holy-rollering them.",hillbilly,verb,2,To portray or act as an uneducated and unsophisticated fool.,,
3164,"Cicero in his Offices declares his opinion , that a vendor ought not to appoint a puffer to raise the price",puffer,noun,9,One who is employed by the owner or seller of goods sold at auction to bid up the price; a by-bidder.,,
574,"She missed the fish diet of her own country, and twice every summer she sent the boys to the river, twenty miles to the southward, to fish for channel cat.",cat,noun,18,Abbreviation of catfish.,,
447,He's a silly bugger for losing his keys.,bugger,noun,3,A foolish or worthless person or thing; a despicable person.,,
2625,I'm never going to date her; she's a right munter.,munter,noun,1,An ugly person.,,
2626,He's a real munter; he was really munted at the party.,munter,noun,2,A person often impaired by alcohol or recreational drugs.,,
2894,"According to another superstition, the longer the peel, the longer the peeler's life would be.",peeler,noun,2,One who peels.,,
4428,"In a sense, the ‘scientistic’ polemicist who stumbles across unseen disciplinary boundaries in an ultracrepidarian stupor is not always entirely in the wrong; there are now in fact contested territories where the dissonances are quite real.",ultracrepidarian,adjective,1,Giving opinions on something beyond their knowledge or expertise.,,
2806,"They found, for example, a significant difference in emphasis as you moved from the “old money” rich, or true elite, to the “new money” rich, or unseasoned elite. The women of “old money” families tend to be relatively indifferent to swings in fashion; and their taste is oriented more to that of the British upper classes than to the French.",old money,noun,1,Families that have been wealthy for generations or members of such families.,,
417,"Is it the braggart and the bristler, the man who has nothing to learn, who would build a wall between America and other lands, or would array America against the world;",bristler,noun,1,Someone or something that bristles.,,
2115,‘Himbo’ Flexes His Pecs in U.K. Ads [title],himbo,noun,1,A physically attractive man who lacks intelligence; the male equivalent of a bimbo.,,
3605,"Since 1982, it has shrunk by 250 meters.",shrink,verb,2,To become smaller; to contract.,,
1631,an artificial fruit flavor,fruit,noun,4,"Of, belonging to, related to, or having fruit or its characteristics; (of living things) producing or consuming fruit.",,
891,old crocks race ― veteran car rally,crock,noun,4,An old or broken-down vehicle (and formerly a horse or ewe).,,
4208,"She doesn't know whom to believe, but she agrees with the tinfoil hatters about one thing: Something is weird here.",tinfoil hatter,noun,1,One who believes in and/or propagates conspiracy theories.,,
1513,"Then I turned to him and said, ""O my lord, I have that to propose to thee wherein thou must not cross me; and this it is that, when we reach Baghdad, my native city, I offer thee my life as thy handmaiden in holy matrimony, and thou shalt be to me baron and I will be femme to thee.""",femme,noun,1,"A woman, a wife; (now chiefly Canada, US) a young woman or girl. [from 19th c.]",,
3829,"I like better gin-and-water than claret. I like a sanded floor in Carnaby Market better than a chalked one in Mayfair. I prefer Snobs, I own it.",snob,noun,3,A member of the lower classes; a commoner. [from 19th c.],,
544,"A large number of estates, and all the most important offices, were taken over by incoming Russian officials, adventurers and carpetbaggers. At the head of them were figures like General Alexander Rimsky Korsakov , […]",carpetbagger,noun,2,"One who comes to a place or organisation with which they have no previous connection with the sole or primary aim of personal gain, especially political or financial gain.",,
2062,"Here lies poor Ned Purdon, from misery freed, / Who long was a bookseller's hack.",hack,noun,38,A writer who hires himself out for any sort of literary work; an overworked man; a drudge.,,
2367,"And who put you in charge of a public vigil, leaderfag?",leaderfag,noun,1,"A person, especially a member of the hacktivist group Anonymous, who acts bossy or unilaterally declares themselves to be in control of something.",,
3451,The things which he had to put on were so old and ragged that they would scarce hold together; and they were so dirty that no ragamuffin of the street would have picked them out of the gutter; no scarecrow in the fields ever had such clothes.,scarecrow,noun,1,"An effigy, typically made of straw and dressed in old clothes, fixed to a pole in a field to deter birds from eating crops or seeds planted there. [from 1530s]",,
3945,64 is the square of 8.,square,noun,5,"The product of a number or quantity multiplied by itself; the second power of a number, value, term or expression.",,
3358,I don't believe you are that stupid. It must be your red fascist reality bending agenda at work.,red fascist,adjective,1,Communist.,,
1518,"I love butches, though. I dated a femme once. That was wrong on so many levels.",femme,noun,2,"A lesbian or other queer woman whose appearance, identity etc. is seen as feminine as opposed to butch. [from 20th c.]",,
4654,"Despite its ubiquity in 1990s Japanese culture, one telephone survey of 200 people conducted in the New York area did not find a single individual familiar with the use of the term ""yellow cab"" in reference to Japanese or Asian women.",yellow cab,noun,2,"An Asian woman who sleeps with white men, particularly such Japanese women when regarded as a race traitor.",,
224,"Isn't my house classic? The columns date all the way back to 1972. Wasn't my Mom a betty? She died when I was just a baby. A fluke accident during a routine liposuction. I don't remember her, but I like to pretend she still watches over me.",betty,noun,6,An attractive woman; a babe. [from 20th century],,
2640,"And finally the biggest thank you of all to my partner Steven Winston for your love, enthusiasm, encouragement, support, humour, nags, and glasses of wine.",nag,noun,5,A repeated complaint or reminder.,,
2699,"""Be wary of being a Negative Nancy.""",negative Nancy,noun,1,A person who is considered excessively and disagreeably pessimistic.,,
2095,"They're bound to be whoppers, aren't they, competitive eaters? Lard-buckets. Human dumpsters. Mega heffalumps. Not at all. This hard-to-swallow documentary comes to show us that top-class scoffers are actually athletes, not only fit but thinner than average.",heffalump,noun,3,A clumsy or overweight person.,,
1886,All iron mortars now in use have gomer chambers and brass ones conical.,gomer,noun,2,"A conical chamber at the breech of the bore in heavy ordnance, especially in mortars.",,
1943,"In spite of repeated public statements and reminders, school boys and others are continuing to trap `bluies' and `greenies,' particularly in the Brisbane area, the Department of Agriculture and Stock announced to-day. These birds belong to a family more correctly called lorikeets, and as such, under the Fauna Protection Act, they are totally protected throughout Queensland.",greenie,noun,7,Any of various birds having predominantly green plumage.,,
441,"I bring up the account's regular posting of 'Bucktees,' Toronto slang for homeless people, and how often the account displays their erratic behaviour for laughs.",bucktee,noun,1,A homeless person or a drug addict.,,
2734,"[H]ad he dropped it [a hat] like a gooſe—like a puppy—like an aſs—or in doing it, or even after he had done, had he looked like a fool,— like a ninny—like a nicompoop — it had failed, and the effects upon the heart had been loſt.",nincompoop,noun,1,A foolish or silly person. [from 16th c.],,
2768,Some nut job from the government actually thought he could tax our moonshine!,nut job,noun,1,Someone who is crazy (insane).,,
3728,"He short-changed a partner, leaving him feeling skanked.",skank,verb,4,"To cheat, especially a friend.",,
3468,"An arctic wind whooshes down Columbus Avenue like the IRT express, catching her bags, scarecrowing her arms, and threatening to take her broad-brimmed hat downtown.",scarecrow,verb,1,"To cause (a person, their body, etc.) to look awkward and stiff, like a scarecrow (noun sense 1).",,
2133,Knots Landing surged even higher in the ratings once Donna Mills was added as the neighborhood home wrecker Abby.,home wrecker,noun,1,"A person who gains the affections of someone already married or engaged, and thus causes the dissolution of the marriage or engagement.",,
3241,"[…]  it is incredible, and scarce to be imagin’d, how the Posts of Houses, and Corners of Streets were plaster’d over with Doctors Bills, and Papers of ignorant Fellows; quacking and tampering in Physick, and inviting the People to come to them for Remedies;",quack,verb,3,To practice or commit quackery (fraudulent medicine).,,
1781,"Gendies are so American/Western centric.Y'all in the quotes saying ""womanhood has never included you, let it go""Well explain fgm? Explain breast ironing? Mutilation done to women in the name of ritual, cos we're believed to hold special powers in our vagina. Explain that too!!",gendie,noun,1,A person who is deeply invested in novel gender identities and the subversion of traditional gender ideology.,,
4131,[W]e also desired to shock the staid older party members and the tankies. The tankies and softliners differed as to what sort of magazine Challenge should be.,tankie,noun,1,A member of the Communist Party of Great Britain who supported the Soviet Union's policy of crushing revolts in Hungary in the 1950s and Czechoslovakia in the 1960s by sending tanks into those countries.,,
2685,"He pushed aside his ponytailed minion and stepped right up to Tank, who gave him a perplexed look as he barked a few words in guttural German. “I don't speak Nazi,” Tank said.",Nazi,proper noun,2,The German language.,,
3758,"[…]  How many times I have heard a woman called a slattern, because she could not keep a house in order, when had she been allowed to write out her sublime thoughts, which were all in another direction, she would have astonished the world with her genius.",slattern,noun,2,"One who is uncareful or unconcerned about appearance or surroundings, usually said of a dirty and untidy woman.",,
4016,"He also said that minks, muskrats, foxes, coons, and wild mice were found there, but no squirrels.",squirrel,noun,1,Wikispecies,,
4596,"Eventually, Don and Jim built nice big houses on their lots. We enjoyed watching them being built. I remember Don's builder came out and “witched” for a well.",witch,verb,1,To dowse for water.,,
2187,illegal immigrant,illegal,adjective,5,Being or doing something illegally.,,
764,One does not become a transvestite Communazi. One simply is a transvestite Communazi.,communazi,noun,1,A communist.,,
336,Jonny always bots off me. I just wish he’d get his own pack.,bot,verb,2,"To ask for and be given something with the direct intention of exploiting the thing’s usefulness, almost exclusively with cigarettes.",,
2649,"I guess it happens all the time in crime stories where the detective suddenly remembers a bit of conversation that nags him in some way, then for some inexplicable reason, it's just right there in front of you, like a sign pointing 'here!",nag,verb,2,To bother with persistent thoughts or memories.,,
3320,Jonathan Goldberg further explores the implications of queering history in his essay in the same volume.,queer,verb,5,"To reevaluate or reinterpret (a work) with an eye to sexual orientation and/or to gender, as by applying queer theory.",,
2960,"If it were not for this purging effect wrought upon our minds by culture, the whole world, the future as well as the present, would inevitably belong to the Philistines.",philistine,noun,1,"A person who is ignorant or uneducated; specifically, a person who lacks appreciation of or is antagonistic towards art or culture, and who has pedestrian tastes.",,
593,"""Bless you, he would think nothing of throwing you downstairs if you have a disagreement. He is a primitive caveman in a lounge suit. I can see him with a club in one hand and a jagged bit of flint in the other.""",caveman,noun,2,"A person with backward, primitive behavior, opinions, or interests.",,
1801,*gigapassoid voice* ugh I'm so masculine,gigapassoid,noun,1,A transgender person who passes extremely well.,,
2309,"There was a perception that a pupil could be clever, yet not a 'keeno', so long as one's display of ability was not too overt. Such 'cool' cleverness is an attribute for the astute teacher to foster in boys!",keeno,noun,1,A pupil who works hard; a swot.,,
