id,example,term,pos,sense_id,definition,ANNOTATION,DEFICIENT SENTENCE
2668,"Breeding is a consuming goal, and the ascendance of the sex drive is nearly as apparent in the behavior of a mountain goat billy. So given over is he to following and defending a succession of nannies as he searches for one in heat , he loses interest in food altogether;  […]",nanny,noun,4,A female goat.,,
796,"Lmao they saw the numbers drop and only coomers used the site. [quoting an article titled ""OnlyFans Drops Planned Porn Ban, Will Continue to Allow Sexually Explicit Content""]",coomer,noun,1,"A man who is addicted to masturbation; by extension, anyone who is excessively horny.",,
917,"This is the age of the CryBully, a hideous hybrid of victim and victor, weeper and walloper. They are everywhere, these duplicit Pushmi-Pullyus of the personal and the political",crybully,noun,1,"A person who engages in intimidation, harassment, or other abusive behaviour while claiming to be a victim.",,
4067,"There is a swarm of 'suckers,' 'hoosiers,' 'buckeyes,' 'corn-crackers,' and 'wolverines,' eternally on the qui vive, in those parts—a migratory race of bipeds—who float about from spot to spot, 'squatting,' for the nonce, wherever their fancy or interest may incline them; and a rougher set of men will rarely be met with, saving the genuine 'voyageurs,' or 'trappers'—so notorious for their hardihood.",sucker,noun,14,An inhabitant of Illinois.,,
1546,"Briefly put, the image of the ""poor"" in Appalachia imposed by the poverty workers on these people relies on a faulty model.  […]  In their own efforts to explain the wary attitudes of Appalachian people toward ""flatlanders,"" the poverty workers  […]",flatlander,noun,1,"A person who lives at, lived at, or was raised by someone at a low altitude or from any city. A person not raised in or by someone directly from high mountain areas. (used by those who were born, raised, and are still living in higher altitude non-city or city like areas).",,
582,"In the story, Lady Ina gossiped and catted about a parade of the rich and famous—Jackie Kennedy looking like an exaggerated version of herself, Princess Margaret so boring she made people fall asleep, Gloria Vanderbilt so ditzy she didn't recognize her first husband.",cat,verb,5,To gossip in a catty manner.,,
3613,"You need to see a shrink, you crazy fool.",shrink,noun,2,A psychiatrist or psychotherapist.,,
1460,"[H]e would sometimes reward her with a hearty slap on the back, and protest that she was a devilish good fellow, a jolly dog, and so forth; all of which compliments Miss Sally would receive in entire good part and with perfect satisfaction.",fellow,noun,7,Usually qualified by an adjective or used in the plural: an individual or person regardless of gender.,,
4265,a five-tool player,tool,noun,7,"A particular skill pertaining to baseball (such as hitting, running, etc.).",,
4055,"My blood is mingled with the crime of lust; / For if we two be one, and thou play false, / I do digest the poison of thy flesh, / Being strumpeted by thy contagion.",strumpet,verb,1,To debauch.,,
1274,"I have no idea of what any of this means, but if standing up to bullies, asserting myself when I disagree and taking responsibility for what I post by putting my name to it, is being an ""EGOFAG"" then I bear the label with pride.",egofag,noun,1,An egotistical or attention-seeking person.,,
1922,"Her crimson dress inflames grey corridors, or flaring in a sunshaft through high branches makes of the deep green shadows a greenness darker yet, and a darkness greener.",greener,adjective,1,comparative form of green: more green,,
92,"Esshole, Asshole, the hole under the fire to hold ashes.",asshole,noun,4,A receptacle under a fire grate for collecting ashes.,,
1517,"Given the myth that lesbian femmes will eventually leave their butches for men, there is an understandable unwillingness to acknowledge bisexual femmes, who really might do it — as indeed they have every right to.",femme,noun,2,"A lesbian or other queer woman whose appearance, identity etc. is seen as feminine as opposed to butch. [from 20th c.]",,
3252,"But our mercifull Queene Elizabeth hath not burned the popiſh prieſtes on the alters where they committed idolatrie in ſaying of Maſſe, and worſhipped a piece of breade for the bodie of Chriſte  and yet you count not her for a godly and mercifull Queene.",queen,noun,2,A female monarch.,,
1872,"Do “explore the world around you,” Google exhorts its users; on the other hand, don't “be creepy or rude .” That Google recognizes the pejorative slang term “Glasshole” in its own documentation is telling, for it shows that  […]",glasshole,noun,1,"A person who wears spectacle frames equipped with PDAs (especially with cameras) that display into the user's eyes, and who acts like a jerk or films inappropriately. [from 2013]",,
1164,"Hailey decided to show off her drip with a soft, white fluff jacket  […]",drip,noun,6,Style; swagger; fashionable and/or expensive clothing.,,
3234,Polly : Are you going to let that shyster in there?,quack,noun,2,"A fraudulent healer, especially a bombastic peddler in worthless treatments, a doctor who makes false diagnoses for monetary benefit, or an untrained or poorly trained doctor who uses fraudulent credentials to attract patients [from c. 1630]",,
3917,The big spider gave me a spook.,spook,noun,3,A scare or fright.,,
687,Long as I have my clams I don't give a damn about revolution / Long as I have my rice I don't have to think twice about a solution,clam,noun,1,"A bivalve mollusk of many kinds, especially those that are edible; for example soft-shell clams (Mya arenaria), hard clams (Mercenaria mercenaria), sea clams or hen clam (Spisula solidissima), and other species. The name is said to have been given originally to the Tridacna gigas, a huge East Indian bivalve.",,
1345,"As soon as the door thunks shut and the bolts clank, he says, “What the fuck you looking at, fagboy?”",fagboy,noun,1,"A contemptible young gay man, sometimes partially a term of endearment for a submissive bottom or sex partner.",,
913,"Tony's face expressed relief, and Nettie sat silent for a moment until the vicar said “It was a generous impulse, but it may have been a momentary one, while in the case of monk and crusader there must have been a sustaining purpose, and possibly a great abnegation, a leaving of lands and possessions.”",crusader,noun,1,A fighter in the medieval Crusades who had taken the Cross.,,
2762,"The losing agro thing is just because you’re grouping with nubcakes who don’t have the first clue about what you need to do and how to watch their own threat levels. A classic sign is someone who opens up the instant the mob is pulled. Two kinds of people do this, clueless nubcakes who just have no concept of group dynamic and damage meter maniacs who don’t give a shit about group dynamic as long as there damage meter penis is longer, it’s hard to say which one is the worst to have in a party. They’re both intensely irritating and both often cause wipes. Heh.",nubcake,noun,1,A noob; a newbie.,,
2134,Let's get a couple of hood rats over for the party tonight.,hood rat,noun,1,"A person from an urban neighbourhood who overtly exhibits attributes associated with inner city life, especially in both behaviour and appearance.",,
1661,"[…]  I mean, come on, it's total shit and worthy of chuckle or two at the expense of the fucklings who posted it!",fuckling,noun,1,A stupid or annoying person.,,
3994,Staash tipped up the rim of his hat and looked me square in the eyes as the cigarette dangled from his lips.,square,adverb,1,Directly.,,
2047,Wales are awarded a free kick after a minor hack by Järvinen on Llewellyn.,hack,noun,20,A kick on the shins in football of any type.,,
1029,"American Blacks have made huge strides over the years, but the Demoncrats invent class warfare and inequality issues.",Demoncrat,noun,1,A member or supporter of the Democratic Party (with an implication that these people are demonic).,,
2481,"""The skull is all-purpose,"" said Sasha Frere-Jones, a music critic at The New Yorker. ""It simultaneously refers to horror movies, to the Misfits and, by extension, all punk rock, and to a generalized culture of blackness and spookiness and the larger, mallGoth culture.""",mallgoth,noun,2,The culture or fashion style adopted by such a person.,,
4522,[…]  You need to go on back to the ghetto and make a bunch of ghetto babies and live off of welfare. I heard that you and your mama were welfare queens.”,welfare queen,noun,1,"A woman collecting welfare, seen as doing so out of laziness, rather than genuine need.",,
943,"A cumberworld, yet in the world am left, / A fruitles plot, with brambles ouergrowne, / Miſliued man of my vvorlds ioy bereft, / Hart-breaking cares the ofspring of my mone.",cumberworld,noun,1,"Someone who, or something which, is an encumbrance on the world; a useless person or thing.",,
2243,"I think she's a very nice girl, but she's marrying that jerkoff.",jerkoff,noun,1,"Someone who behaves obnoxiously, rudely, inappropriately, or is ignorant of certain social norms, usually a male.",,
2385,"If all of that bothers you so much, you libturd assholes should have come up with a nominee other than Hillary.",libturd,noun,1,A liberal.,,
2890,I was standin' there and the car came down the street with the two peelers comin' after them and I'm standin' here with [my son] in my arms.,peeler,noun,1,A police officer.,,
2434,"Carl Sewell, CEO of Sewell Village Cadillac in Dallas and other automobile dealerships, tells the story of how Sewell Village ""lot lizards” significantly improved their performance.",lot lizard,noun,4,A salesperson at an automobile dealership.,,
516,Some episkoposes have a one-man cabal. Some work together. Some never do explain.,cabal,noun,4,An identifiable group within the tradition of Discordianism.,,
2766,"The game is the glue that binds real people behind the toons, it was a fantastic game and in many ways it still is but in many other ways it just isn't any more – this is the point that's missed by the nubcake ""12 million subscribers can't be wrong"" crowd.",nubcake,noun,1,A noob; a newbie.,,
3077,This time it is the worst kind of call a murder police can get.,police,noun,2,"The staff of such a department or agency, particularly its officers; (regional, chiefly US, Caribbean, Jamaica, Scotland, countable) an individual police officer. [from 19th c.]",,
4189,A technotard is a person who is unable to get around on their phone or computer or has to hand over the remote to any new technology.,technotard,noun,1,A person who is incapable of comprehending new technologies and their uses.,,
1767,"He turned out to be a proper geezer who was willing to listen to my proposition that if he took the door at the Ministry, I would pay him £400 a month to mark my cards.",geezer,noun,2,Someone affable but morally dubious; a wide boy.,,
3213,Then he lay me down and slid his penis in my puss-puss. They watched him fuck his princess while they slid fingers into pussys and kissed. Then they all wanted to do what I was doing cause it looked like I was enjoying myself - and they each lay down and let my daddy fuck them one by one. Each of the girls giggled as he slid it in them. I licked their puss-pusses while daddy fucked em good until daddy could hold back no more.,puss-puss,noun,1,The vulva.,,
2548,"At one point, money was stolen from one of the bedrooms.  […]  Afte that, the family employees were often tested. [Katherine] Jackson would leave the alarm on the closet unarmed, the one in which she kept her minks, chinchillas, and other expensive furs.",mink,noun,3,An article of clothing made of mink.,,
1393,"As the poison has gone out of the European wound, the Conservative Party should now be able to tolerate a Federast leader.",federast,noun,1,"A federalist, especially in the EU.",,
3791,Our Polly is a sad Slut! nor heeds what we have taught her.,slut,noun,6,"A bold, outspoken woman.",,
868,"""What is that supposed to be?"" he asked in his usual creepoid manner.",creepoid,adjective,1,Creepy.,,
3339,"You cant please radlibs, you can only get rid of them one election at a time like we have been for 11 years.",radlib,noun,1,A radical liberal.,,
2999,"But me, I joined the party to fight the pigs. That′s why I joined. Because my experience with the police was always negative.",pig,noun,9,A police officer. [From ante 1785.],,
374,"Boy, that tastes good!",boy,interjection,1,"Exclamation of surprise, pleasure or longing.",,
1381,"I remember, too, a ditty: ""Fatty, fatty bom bom, curi curi jagung; mata-mata tangkap, masuk dalam lokap"" (the fat one steals the corn, gets arrested by police and is thrown into the lock-up.",fatty bom bom,noun,1,A fat or overweight person.,,
3717,"Hughes CRAVED dirt. Hughes CRAVED slander skank to share with Mr. Hoover. What Hughes CRAVED, Hughes BOUGHT. ¶ Pete bought an issue’s worth of dirt. His cop contacts supplied him with a one-week load of lackluster skank.",skank,noun,2,"Anything that is particularly foul, unhygienic or unpleasant.",,
2216,"A nephew of hers, after receiving some learning at her ladyship's expence, got a commission, and fell upon the field of Waterloo; another is still at her heels, as a sort of jackall to fetch and carry when required.",jackal,noun,2,"A person who performs menial/routine tasks, a dogsbody.",,
711,"The new playground, which is made of wood, features a climber, swings, a sand play area with a play hut and digging toys.",climber,noun,2,Something that is used for climbing.,,
1043,"THINGS YOU NEVER HEAR: ""Please stop sucking my dick or I'll call the police.""",dick,noun,3,The penis.,,
1132,"""There's that dork whose wife cut off his dork."" And when people ask him for an autograph he writes, ""Best of luck to Betsy. Signed, the guy whose wife cut off his penis.""",dork,noun,2,The penis. [from the 20th c.],,
2360,That jerk did such a bad job parking his landwhale that it's taking up four parking spaces!,landwhale,noun,2,An excessively large motor vehicle.,,
2671,"In real life, says a Democratic campaign aide, members of Congress are too nannied by staff to stride about hatching plots, one-on-one.",nanny,verb,2,To treat like a nanny's charges; to coddle. [from mid-20th c.],,
2777,"I mentioned something of intelligent nature created by devils called an obeast or called that by the blues; in the article, “Real Weapons of Mass Destruction.”",obeast,noun,2,A intelligent demonic influence or entity.,,
3167,"The switch engine is unstable but a number of them working in combination can form stable puffers, spaceships and rakes.",puffer,noun,14,A finite pattern that moves like a spaceship but leaves a trail of debris.,,
1932,"Mid-August, normally prime berry-picking time, came and went. Still too many greenies.",greenie,noun,4,An unripe fruit.,,
1015,"Everyone has met a Debbie Downer. They are filled with complaints, see everything darkly, and feel like a victim of life. And that is the energy they bring to themselves.",Debbie Downer,noun,1,A naysayer; one whose negative remarks depress or dissuade others.,,
3533,He's a selfawarewolf who almost realized his input was unwanted on a post about women.,selfawarewolf,noun,1,"A person who recognizes their own flaws, mistakes, or faulty logic, but does not see them as a problem to be addressed or connect them to their own behaviour and beliefs.",,
3729,He thought I was trying to skank him and wouldn’t wait any more; he wanted to be there. He wouldn’t wait!,skank,verb,4,"To cheat, especially a friend.",,
4385,The USA has far too many Trumpoid anti-vax idiots to make herd immunity a reality.,Trumpoid,noun,1,A supporter of Donald Trump.,,
3157,The pseudoscientist will claim that these theories are well supported by the evidence...,pseudoscientist,noun,1,A practitioner of pseudoscience; a bogus or sham scientist.,,
1809,...low strings later than the mid-seventeenth century are commonly gimped  to allow sufficient tension without excessive mass or stiffness.,gimp,verb,1,"To wrap or wind (surround) with another length of yarn or wire in a tight spiral, often by means of a gimping machine, creating 'gimped yarn', etc. Also, generally, to wrap or twist with string or wire. See gimped.",,
2409,"Globals are visible anywhere in your application, whereas locals are visible only in the function in which they're declared.",local,noun,5,A locally scoped identifier.,,
3454,"So, a true Souldier, / He is his Countreys ſtrength, his Soueraignes ſafety, / And to ſecure his peace, he makes himſelfe / The heyre of danger, nay the ſubiect of it, / And runnes thoſe vertuous hazards, that this Scarre-crovv / Cannot endure to heare of.",scarecrow,noun,2,"A person regarded as resembling a scarecrow (sense 1) in some way; especially, a tall, thin, awkward person; or a person wearing ragged and tattered clothes.",,
1626,They shall eat the fruit of their doings.,fruit,noun,3,"An end result, effect, or consequence; advantageous or disadvantageous result.",,
1056,"...down, down, sinking down faster than she's so far moved, the dickhead exploding up into all that wet, warm slime...",dickhead,noun,2,The glans penis.,,
340,"Bourgie girl / Grab her hand / Fuck that bitch, she don't wanna dance",bourgie,adjective,1,Alternative form of bougie.,,
2747,"He's a nonce[. A] nonsense merchant, a paedophile[,’ Terry explained.]",nonce,noun,5,A pedophile.,,
3916,"""I'll say what I think, no more and no less, and I won't be scared by you or your spooks into altering my opinions.""",spook,noun,1,A ghost or phantom.,,
210,"But Wasting Light, recorded analog to tape  with no computers, not even to mix or master, is an entirely different beast.",beast,noun,7,"A thing or matter, especially a difficult or unruly one.",,
3079,"Then there were the taste police, who thought that this bulky modern machine was an inappropriate intrusion  […]",police,noun,3,People who try to enforce norms or standards as if granted authority similar to the police.,,
4309,"Speaking of knockout panoramas, if you′re fit then consider doing the taxing, winding, 8km tramp up Mt Roy , start 6km from Wanaka on Mt Aspiring Rd.",tramp,noun,4,"A long walk, possibly of more than one day, in a scenic or wilderness area.",,
724,You're an arrogant cockfag who thinks he's a lot cleverer than he is.,cockfag,noun,1,An extremely contemptible person.,,
3267,"Each time a worker shakes the queen, she grasps the queen with her forelegs and shakes her own body for a second or so, delivering 10 to 20 vigorous shakings of the queen  […]",queen,noun,6,"Worker bees around the queen (sense 6) of the hive, marked with a pink dot A reproductive female insect in a hive, such as an ant, bee, termite or wasp.",,
4,"After all, no one respects an Aberzombie clone who's just following the trendies!",Aberzombie,noun,1,An unthinking conformist who wears fashions from or in the style of the brand Abercrombie & Fitch.,,
502,"Her face wasn't quite as pretty as he had hoped — Earl, the other mechanic back at his father's place called this kind of girl a Butterface...",butterface,noun,1,A person who has an attractive body but less attractive face.,,
4644,"Quite simply, to a wowser, adults should not be allowed to see, hear and read as they wished, but should only be allowed to see hear and read that which fully conforms to Australia's Christian heritage […] .",wowser,noun,2,"One with strong moral views against excessive consumption of alcohol, gambling, pornography, etc., who seeks to promulgate those views.",,
1945,"In the summer time, live bait is often used almost within throwing distance of the jetties for the kingfish and cobia. Local captains use greenies or threadfin herring primarily and catch them on gold hooks right outside the Stuart inlet.",greenie,noun,8,"A Atlantic thread herring (Opisthonema oglinum), a herring-like fish in the family Clupeidae.",,
637,All firefighters report to the fire chief.,chief,noun,1,"A leader or head of a group of people, organisation, etc. [from 13th c.]",,
1228,"There after the images and reliques were orderly disposed, the great Priest compassed about with divers pictures according to the fashion of the Ægyptians, did dedicate and consecrate with certaine prayers a fair ship made very cunningly, and purified the same with a torch, an egge, and sulphur;  […]",egg,noun,1,"An approximately spherical or ellipsoidal body produced by birds, insects, reptiles, and other animals, housing the embryo within a membrane or shell during its development.",,
4322,One head of a small gay charity visibly flinched when I mentioned my boyfriend and has been cold towards me ever since. I've even caught someone staring down my top to see if I'm transgender.,transgender,adjective,1,"Having a gender (identity) which is different from one's assigned sex, or pertaining to a person who does (a trans man, trans woman, or someone non-binary, e.g. agender, bigender, or third-gender).",,
3875,"You pursed your mooth in shape like O,And sook'd the air in, might and main",sook,verb,1,Alternative spelling of suck,,
2840,"When a run is ""paddocked,"" shepherds are not required;—but boundary-riders are employed, each of whom is supplied with two horses, and these men are responsible not only for the sheep but for the fences.",paddock,verb,2,To enclose or fence in (land) to form a paddock.,,
3117,"Yvonne and Lee Swee potatoed Deputy Lestrade multiple times before Sheriff Moran potatoed them both.  […]  Suddenly, Sheriff Moran heard the click click of an empty weapon. He turned to see that both Mayor Eliza and Kat had run out of ammunition.",potato,verb,2,To hit with a thrown or fired potato.,,
2405,"The expresses skipped my station, so I had to take a local.",local,noun,3,Clipping of local train.,,
3421,"An early operator in the field, Ivy Lee, is reported to have changed the image of John D. Rockefeller from robber baron to philanthropic old gentleman who loved to play golf and hand out shiny coins to children.",robber baron,noun,2,"Especially in the 19th and early 20th centuries, a business tycoon who had great wealth and influence but whose methods were morally questionable and often unethical.  [from 1870s]",,
4635,Wordsters of etymological persuasion also hope to be sitting in the catbird seat when it comes to locating the origins of colorful phrases.,wordster,noun,2,One who studies words.,,
63,"We annoyed the antilifers with prolife/family literature , and especially with well-written news releases, which were published surprisingly often.",antilifer,noun,1,A person who holds pro-choice beliefs.,,
4256,"Hand me that tool, would you?",tool,noun,1,A mechanical device intended to make a task easier.,,
1593,And every time I'm meant to be acting sensibleYou drift into my headAnd turn me into a crumbling fool.,fool,noun,1,A person with poor judgment or little intelligence.,,
2073,Is it better to never be than to be and eventually become a has-been?,has-been,noun,1,"A person, especially one formerly popular or influential, who continues in their field after their popularity or effectiveness has peaked and is now in decline.",,
2887,"All the time I was stretched out on the infirmary cot I kept looking at the blank walls and seeing the mean, murdering faces of those Southern peckerwoods when they went after Big Six and the others with their knives.",peckerwood,noun,3,"A white person, especially a Southerner, or one who is ignorant, rustic, or bigoted.",,
2342,"Have you ever gone shopping with a Know-It-All girlfriend and she insists,  without your consent or consulting you first, to choose your outfits for you?",know-it-all,noun,1,"Someone who claims to be knowledgeable or an expert in something, obnoxiously dismissing the opinions, advice, suggestions, etc. of others.",,
289,"Look here, my body snatchers, you have unlawfully abridged the liberty of one of the sons of the sovereign State of New York!",body snatcher,noun,1,"One who makes arrests, such as a bailiff or policeman.",,
998,"A sort of pistol, called a dag, was used about the same time as hand guns and harquebuts.",dag,noun,6,A kind of large pistol.,,
1050,"“I am a detective,” said Hercule Poirot with the modest air of one who says “I am a king.”“Good God!” The young man seemed seriously taken aback. “Do you mean that girl actually totes about a dumb dick?”",dick,noun,7,A detective.,,
4147,"There were the tawny rocks, like lions couchant, defying the ocean, whose waves incessantly dashed against and scoured them with vast quantities of gravel.",tawny,adjective,1,Of a light brown to brownish orange colour.,,
348,My only boy fell by the side of great Dundee.,boy,noun,2,A son of any age.,,
1411,"When you style them, you of the little wit, / Old Master this and Early the other, / Not dreaming that Old and New are fellows, / That a younger succeeds to an elder brother, / Da Vincis derive in good time from Dellos.",fellow,noun,1,A companion; a comrade.,,
104,“Away with them!” cried the Greeks; “we want no Latin allies! Away with the worship of the azymites!”,azymite,noun,1,"One who administers the Eucharist with unleavened bread, in particular a member of the Latin Church or Roman Catholic Church.",,
858,"""Outrageous!"" said Tylan. ""You know, without Fingers and baby Trev, we could have won.""""Yeah, Trevor, what a creep — running off home at half-time like that,"" said Frankie.",creep,noun,8,"Someone annoyingly unpleasant, especially one who is strange or eccentric.",,
1984,"It took place some time ago but it the documentary was shown last night about the two guntards who used body armor, automatic weapons and body armor piercing bullets to rob a bank in North Hollywood, California.",guntard,noun,1,A person obsessed with owning guns; a zealous supporter of the right to bear arms.,,
