id,example,term,pos,sense_id,definition,ANNOTATION,DEFICIENT SENTENCE
4119,"My new job suits me, as I work fewer hours and don't have to commute so much.",suit,verb,5,To please; to make content; to fit one's taste.,,
2617,"The Bat—they called him the Bat. […]. He'd never been in stir, the bulls had never mugged him, he didn't run with a mob, he played a lone hand, and fenced his stuff so that even the fence couldn't swear he knew his face.",mug,verb,4,To photograph for identification; to take a mug shot.,,
749,"I'm not a big fan of government-binding syntactic theory in its extremes, but I still don't see why Chomsky is filed under prescriptivism. He is not a prescriptivist, or even a lousy commafucker .",commafucker,noun,1,A person who is pedantic about grammar.,,
2242,"This longtime West End eatery prepares chicken the way locals like it: curried, fried, jerked, and baked.",jerk,verb,8,"To cure (meat) by cutting it into strips and drying it, originally in the sun.",,
1326,"Again, the division of the higher forms of animal life into males and females—obnoxious as it is to the champions of the Woman's Rights Movement, and inconvenient as it proves to a certain class of world-betterers—can neither be abrogated nor explained away. There is, to be sure, a time in the life of hen pheasants, and other female gallinaceous birds, when they—in the magniloquent language of a weekly literary organ of epicœnes and garotters—""rise up and look their tyrant in the face,"" in the hope that, ""ever after, he will sit uneasily on his"" roost.",epicene,noun,2,"An epicene person, whether biologically asexual, androgynous, hermaphrodite, or intersex; an androgyne, a hermaphrodite. [from 17th c.]",,
2573,The woman who used to start the day with a Spin class with Suzanne turned into a mombie —a mom zombie who was a shadow of her former self. Showering was no longer important. Why bother?,mombie,noun,2,"A mother who is consumed by raising her children to the point of being sleep-deprived or simply obsessed, and hence zombie-like.",,
3085,"Policing the relationship between government and business in a free society is difficult. Businesspeople have every right to lobby governments, and civil servants to take jobs in the private sector. Governments have to find the best people to fill important jobs: there is a limited supply of people who understand the financial system, for example.",police,verb,1,To enforce the law and keep order among (a group).,,
4624,"Last year I came across a forum where wolfaboos believed that they were ""special snowflakes"" who where blessed with the ability to physically shape shift into wolves.",wolfaboo,noun,1,"Someone who is obsessed with wolves and identifies with them, especially a furry or otherkin.",,
4455,"The universal belief is, that a person sucked by a vampyre becomes a vampyre himself, and sucks in his turn.",vampire,noun,1,A mythological undead creature said to feed on the blood of the living. [from 1732],,
1270,"Many shave their entire head at the first sign of hair loss, believing that chicks prefer an egghead to a comb-over.",egghead,noun,2,A bald head.,,
3168,"Listen, pukeface — DRIVER. Yes?  CONTROLLER. 135? 135? Where are you? DRIVER. Don't have anything to do with 135.",pukeface,noun,1,"A contemptible, undesirable, or ugly person.",,
3159,"Oh, she's sweet but a psycho / A little bit psycho / At night she's screamin' / ""I'm-ma-ma-ma out my mind""",psycho,adjective,1,Psychotic or otherwise insane.,,
2983,"She built a reputation as a piece of work; if she didn't like a crowd, sometimes she'd walk off stage in midset and call a cab home.",piece of work,noun,2,"A person who has a strong and unusual personality, especially one with seriously unpleasant character flaws (e.g. a nasty piece of work). (This sense came about due to Hamlet’s monologue (see sense 1 above)).",,
2478,"“Funnily enough ‘mallgoth’ was meant to be a bit of an insult,” explains Trinity Levy, the Arizona-based high school senior who started the Instagram account @1990smallgoth. “Being called a mallgoth was the equivalent of being called a poser. The purpose of it was to describe the kids who loved Marilyn Manson and bought Tripp pants from Hot Topic back in the day, but still identified or were seen as goth. I'd say that that broad description is still true at its core. Despite its name, it doesn’t have anything at all to do with the goth subculture besides sharing a few aesthetics.”",mallgoth,noun,1,"Originally (derogatory), an inauthentic or trendy goth; now, a person who dresses in goth-inspired clothes, is interested in industrial metal and nu metal music, etc.",,
692,Jason wouldn't shut his clam about the invaders.,clam,noun,9,mouth (Now found mostly in the expression shut one's clam),,
390,an army brat,brat,noun,1,A human child.,,
3769,Gorgeous Bare Slore ~ALERT,slore,noun,1,A very sexually promiscuous person.,,
2136,"She also heard boys from other classes behind her talking: “So, Teacher Tang is a female hooligan.”",hooligan,noun,1,A person who causes trouble or violence.,,
2458,Your article on England's regional accents confirmed that Geordie has already completely replaced the mackem-speak of Sunderland and other variants in the north-east.,Mackem,noun,1,"A native or inhabitant of Sunderland, England.",,
2681,"All this requires some very careful unpacking, for obviously, Dr. Bosse is “speaking Nazi with the Bormann dialect.”",Nazi,proper noun,1,The language (ideological jargon) of Nazis.,,
4302,Claudia is such a tramp; making out with all those men when she has a boyfriend.,tramp,noun,2,"A disreputable, promiscuous woman; a slut. [from 1922]",,
232,"I'm no bible basher looking to discredit everything I hear, but there is one point that might be interesting to argue...If the bible is the Word of God, which version or language is the official Word, as the meanings change subtley[sic] from one to another?",Bible basher,noun,2,"A person who finds fault with the Bible, Christianity, or Christian teaching.",,
2191,…I've got illegals in my bottom…!,illegal,noun,2,"Contraband, esp. illegal substances such as drugs.",,
2097,St. Andrews — in case you're not up on such weighty matters — is the hoity-toity school where the heirhead they call Wills  will soon begin studying for his history of art degree.,heirhead,noun,1,The foolish heir to a large fortune.,,
1421,"It is now some five years since I conceived the idea of writing a history of my fellow-countrymen in Australasia, but it was only within the last year or two that I could find sufficient time to make any material progress with the undertaking, although I had been collecting the materials for some period in advance.",fellow,noun,4,"A person or thing comparable in characteristics with another person or thing; especially, as belonging to the same class or group.",,
3278,"Ad Hoc Softwares has bright hand-blocked floral cotton bed linens from India, including flat full/queen sheets, were $85, now $51; standard pillowcases, were $18 each, now $10.80  […]",queen,noun,16,Pertaining to a queen-size bed or queen-size bedding.,,
280,"Oscar pondered for a while, then said, ""Oh, but halfcastes don't seem to be any good at all. All the men here are loafers and bludgers, the women practically all whores.""",bludger,noun,1,"A pimp, a man living off the earnings of a harlot.  [From 1856.]",,
1800,that feel when literally one inch of jaw bone decides whether im a twinkhon or a gigapassoid,gigapassoid,noun,1,A transgender person who passes extremely well.,,
3776,"""Yas'm,"" said Prissy and, turning, sauntered down the walk at snail's gait. ""Hurry, you slowpoke!""",slowpoke,noun,1,A person who moves slowly or takes a long time to do something.,,
2709,"They particularly enjoy making fun of one of their fellows who is not present, whom they consider a hopeless nerd – until, that is, they learn he is engaged to marry the boss's daughter.",nerd,noun,1,A person who is intellectual but generally introverted.,,
3350,Fez′s resolutions: […] 3. I will not call Blue ‘Ranga Girl’.,ranga,noun,1,An orange-haired or red-haired person.,,
2923,"So you go to see this peeper, this Marlowe. That was your mistake.",peeper,noun,3,A private detective.,,
545,"Essentially, lawmakers replaced the sticks with carrots.",carrot,noun,3,Any motivational tool; an incentive to do something.,,
3814,"When asked about his Irish name, and how he came by that, McCracken replied ""I's smoked Irish, Judge, just another smoked Irishman.""",smoked Irishman,noun,1,A black man.,,
4201,"Whoa Scott, you really shouldn't be eating Janet's donuts!Haha, don't worry, miss ""thunder thighs"" could do without the extra--",thunder thighs,noun,2,"A person, usually a woman, with fat thighs.",,
1957,"I wonder what her pubic hair looks like. Perfectly manicured? A strip. She seems like a groomer. I down the glass as if it's a shot. The wine floats through my chest, warming me. Must stop imagining Kimmy's pubic hair. Brown pubic hair.",groomer,noun,6,A person who cares for their personal appearance and hygiene (grooming).,,
2606,"The paper gave a start to the theater critic Hilton Als and the novelist Colson Whitehead, both recipients of the Pulitzer Prize. Its resident muckraker, Wayne Barrett, took aim at New York developers and politicians for nearly 40 years, and his obsessive work on Donald J. Trump has become a resource for reporters covering the president today.",muckraker,noun,1,One who investigates and exposes issues of corruption that often violate widely held values; e.g. one who exposes political corruption or the poor conditions in prisons.,,
1768,He was a bit of a geezer. Used to box with the Krays when he was a young 'un.,geezer,noun,2,Someone affable but morally dubious; a wide boy.,,
1733,There is a function for the gadfly who poses questions that many specialists would like to overlook. Polemics is healthy.,gadfly,noun,2,A person or thing that irritates or instigates.,,
171,"Poor bastard, I feel so sorry for him.",bastard,noun,5,A person deserving of pity.,,
2154,"This abovementioned Chandoo or prepared opium for smoking is retailed by them [the East India Company] at 5 pice per hoon, equal to 8000 Spanish dollars per chest, and on the opposite or Queda shore the hoon is sold at 6 pice or 9,600 dollars,  […]",hoon,noun,5,"A unit of weight (about 0.378125 of a gram, or 0.0133 of an ounce) used to measure opium in British-controlled parts of Asia; a candareen.",,
4028,"Yet, incels want nothing more than to finally be desired by and be with a Stacy.",Stacy,noun,1,An attractive woman who is sexually active.,,
3974,"Why, you would not be boosing till lightman's in a square crib like mine, as if you were in a flash panny?",square,adjective,4,Honest; straightforward; fair.,,
3495,"It is never possible to settle down to the ordinary routine of life at sea until the screw begins to revolve. There is an hour or two, after the passengers have embarked, which is disquieting and fussy.",screw,noun,1,A device that has a helical function.,,
1363,"[…]  and, as one cowboy said, ""I didn't get settled in the saddle before that hoss shore sent me on a fartknocker.""",fartknocker,noun,3,"An instance of being thrown from, or hitting the ground after being thrown from, a horse.",,
1328,Of Transvestites and Other Epicenes,epicene,noun,3,"A transsexual; also, a transvestite.",,
2055,I got by on hack work for years before I finally published my novel.,hack,noun,28,"A person, often a journalist, hired to do routine work. [from 17th c.]",,
3678,"“What a simp I am. I can't believe I left it at home.” She leans her forehead against her locker, straightens, and then turns to me. “Can you believe what a simp I am?""",simp,noun,1,A simple person lacking common sense; a fool or simpleton.,,
333,"Most games offer both single player mode, in which a player competes against computer rivals—bots—and a multiplayer mode, which is a contest among people only.",bot,noun,4,"A computer-controlled character in a video game, especially a multiplayer one.",,
4268,In my city keep a toolLil nigga you know the rules,tool,noun,9,A gun.,,
930,"Around 59th and Lexington, where Dry Dock Savings Bank is located, pickings are lush for the purple-pantsuited culture vulture.",culture vulture,noun,1,"A person with a rapacious, sometimes inauthentic, interest in the arts. [from early 20th c.]",,
3393,"He's won his last battle. He failed to win the Korean War. He couldn't win it. He had to sign a truce. That's a loss. Any time Uncle Sam, with all his machinery for warfare, is held to a draw by some rice-eaters, he's lost the battle.",rice-eater,noun,2,A person who is Asian or of Asian descent.,,
2843,"Now I'm not saying that it isn't an edge I cross from time to time, but I need the confidence that some little painslut won't decide afterward to press charges.",painslut,noun,1,A person who enjoys receiving pain.,,
4304,"Then I think I conceive of other worlds and vast structures that pass us by, within a few miles, without the slightest desire to communicate, quite as tramp vessels pass many islands without particularizing one from another.",tramp,noun,3,Any ship which does not have a fixed schedule or published ports of call. [from 1880],,
1493,"Affection! Your intention stabs the heart. / You do make possible things not so held, / Communicate with dreams . / You are coactive with what's unreal / And associate with nothing.",fellow,verb,3,"To pair or suit (someone or something) with some other person or thing; also, to pair or suit someone or something with (some other person or thing); to arrange (things) in pairs.",,
1869,"I'm not being a miserable old git here. I like a laugh as much as anyone, [...].",git,noun,1,"A silly, incompetent, stupid, or annoying person (usually a man).",,
1196,The specimen is a very dwarf form of the plant.,dwarf,adjective,1,Miniature.,,
3141,You drive like one of those prissy ladies at lunch who won't take the last cookie in case somebody else wants it.,prissy,adjective,3,"Well-mannered, well-behaved.",,
2996,"“...Sounds too easy,” Marvin was saying. “What about the pigs?”He meant police.",pig,noun,9,A police officer. [From ante 1785.],,
3999,I cannot square the results of the experiment with my hypothesis.,square,verb,3,To adjust or adapt so as to bring into harmony with something.,,
1283,"Trevor looks kind of emo, rail thin, dark hair, guyliner, wears black all the time.",emo,adjective,3,Associated with youth subcultures embodying emotional sensitivity.,,
3204,"If you start to stare at men's asses, to try & punk them in their moments with God; you are an enemy of God! Anyone looking upon a man as though a woman is in danger of judgement! -<><",punk,verb,2,To forcibly perform anal sex upon (an unwilling partner).,,
2510,"White people, in addition to being the victims of incredibly commonoccurences[sic] of black-on-White crime, mexicunts that enter this countryillegally only to take over neighborhoods and schools and then harrass[sic]the White people whose ancestors built this nation  […]",Mexicunt,noun,1,A Mexican.,,
2094,"'What are you, thumping around like fucking heffalumps? The twins are trying to get to sleep,' he says, staring at us on the bed.",heffalump,noun,3,A clumsy or overweight person.,,
1606,There appears to be no process of gradually fooling oneself while degrading standards so characteristic of the Solid Rocket Booster or Space Shuttle Main Engine safety systems.,fool,verb,1,To trick; to deceive.,,
2916,"As the next five-foot peeler rolled by, Lee grasped his board and clenched his teeth.",peeler,noun,6,An ideal wave.,,
2079,"The little matter of he-bitches wasn't listed in the ""Handbook.""",he-bitch,noun,1,A man who behaves obnoxiously or promiscuously; a male bitch.,,
3679,"The JEWS own this country, the IRISH run it, the BRITISH envy it, the GERMANS cuss it, the NEGROES enjoy it, the FRENCH style and perfume it, the CHINESE wash it, BOOTLEGGERS irrigate it, the GREEKS feed and shine it, the JAPS fear it, MEXICANS hate it, RUSSIANS pity it, the ITALIANS fruit it, ALL NATIONS cigarette it, EVERYBODY likes it, and the AMERICANS—well, those poor simps just pay the bills and can keep out of jail if they behave themselves and are very careful about their driving and parking.",simp,noun,2,Someone who is not worthy of respect.,,
2217,"They have jackalled for the great beast, to pick in turns the bones of each other; they have subserved those above, to oppress and defraud those below; and they are suffering, and, so far as classes can, justly suffering their purgation.",jackal,verb,1,To perform menial or routine tasks,,
1027,"Still can't get over the tone of voice that Democunt used on me when I stated my preference for McCain.Boy, old Obama sure did a bippy-lick on some of these young broads.",Democunt,noun,1,A Democrat.,,
1082,"The hair on my legs is softer than the hair around my dink, but it still grosses me out.",dink,noun,9,The penis.,,
3568,"Over the last six months, as A-list celebrities have shilled for digital currencies and NFTs, Mr. McKenzie, a TV actor best known for his starring role in “The O.C.,” has become an outspoken skeptic.",shill,verb,1,"To promote or endorse in return for payment, especially dishonestly.",,
3342,a stonie and raggie hill,raggie,adjective,1,ragged; rough,,
2959,"Not only was he [Heinrich Heine] not one of Mr. [Thomas] Carlyle's ""respectable"" people, he was profoundly disrespectable; and not even the merit of not being a Philistine can make up for a man's being that.",philistine,noun,1,"A person who is ignorant or uneducated; specifically, a person who lacks appreciation of or is antagonistic towards art or culture, and who has pedestrian tastes.",,
3861,My mother never saw the irony in calling me a son of a bitch.,son of a bitch,noun,1,"An objectionable, despicable person.",,
547,"[H]e called Bill a turnip-headed old carrot cruncher, and other insulting names.",carrot cruncher,noun,1,Someone from a rural background; a bumpkin.,,
650,[Actor] John Harding personified the idle spirit of the times as a tennis-possessed chinless wonder.,chinless wonder,noun,1,"An ineffectual upper-class man, typically dim-witted and of a weak or indecisive character, frequently one who gained his position through nepotism or social connections.",,
466,John said that when he was little he stuck his finger in his bum and tasted his poopies and it was good.,bum,noun,2,The anus.,,
2446,"Some of the world’s best rain forest and volcanic hiking can be found within the lush canopied Caribbean trail systems. Chock-full of waterfalls and hot springs, bright-colored birds and howling monkeys, flora-lined trails cut through thick, fragrant forests and up cloud-covered mountains.",lush,adjective,3,"Dense, teeming with life; luxuriant.",,
1596,Can they think me  […]  their fool or jester?,fool,noun,5,"Buddy, dude, man.",,
4634,"Quite how complete or relevant all this information is to professional wordsters remains to be seen, though desktop publishers will find hyphenation rules included  […]",wordster,noun,2,One who studies words.,,
1339,"Originally seen as a great opportunity to do irreparable damage to religious modernists and ""evilutionists,"" the fundamentalists found, instead, that it was they who were injured by the Scopes trial.",evilutionist,noun,1,"A supporter of the theory of evolution, regarded as an enemy of religion.",,
1542,"Texans ski, Virginian's ski, New Englander's ski, flatlanders from the Midwest ski. We now have more than 3,000,000 skiers in North America and more than 600 organized ski areas  to choose from ...",flatlander,noun,1,"A person who lives at, lived at, or was raised by someone at a low altitude or from any city. A person not raised in or by someone directly from high mountain areas. (used by those who were born, raised, and are still living in higher altitude non-city or city like areas).",,
2260,"Queering the Jew and Jewing the Queer [by] Ri J. Turner. Editor's Note: Interlaced with personal narrative, Ri Turner's essay contributes to an ongoing discussion within Jewish gender studies concerning the relationship between Jewishness and queerness and factors the term genderqueer into both sides of the equation.",Jew,verb,1,To make (more) Jewish.,,
4533,He is a westoid sucking indog,westoid,noun,1,An inhabitant of the Western world; a westerner.,,
1743,"“Gammon, Pen—go on,” Foker said.",gammon,noun,5,"Chatter, ridiculous nonsense.",,
4098,"Be sure to keep your nose to the grindstone today; the suits are making a ""surprise"" visit to this department.",suit,noun,3,"A person who wears matching jacket and trousers, especially a boss or a supervisor.",,
3458,"'Why, my friend,' he said, stopping to contemplate the scarecrow, 'where hast thou gotten these rags and this wound?' / 'I have escaped, sir, from a French prison, and have received a hurt on the forehead.'",scarecrow,noun,2,"A person regarded as resembling a scarecrow (sense 1) in some way; especially, a tall, thin, awkward person; or a person wearing ragged and tattered clothes.",,
1399,"The surface of the Balaton and the surrounding marshes is not less than 24 German square miles, or 384 English square miles; its principal feeder is the Szala, but all the water it receives appears inconsiderable relatively to its superficial extent, and the quantity lost in evaporation.",feeder,noun,5,"A tributary stream, especially of a canal.",,
2504,"No one can independently have the same opinon [sic] as someone else without being a meatpuppet of theirs, eh?",meatpuppet,noun,1,"One whose sole reason for participating in a discussion or forum is to support, or express agreement with, a friend.",,
2210,"The Japanese armored cruiser Nisshin has been hit badly.  Shells have sheared off several main guns and virtually disarmed the vessel.  In the middle of all this, one Ensign Isoroku Yamamoto loses two fingers to the remains of an explosion.  If he'd lost a third, he would've been invalided out of military service.  Thus, by the retention of a single digit would there be rather large consequences a few decades later on down the line.",invalid,verb,1,To exempt from (often military) duty because of injury or ill health.,,
1369,"Then in the case of excisions you have all kinds of secondary changes, pigmentary disturbances, modifications of the passions, alterations in the secretion of fatty tissue.",fatty,adjective,1,"Containing, composed of, or consisting of fat.",,
4527,"So, you want westoids who will look at you like a subhuman gypsy to move in and steal your women while mocking you.Fucking eastern European mentality, it's all about the fucking money.",westoid,noun,1,An inhabitant of the Western world; a westerner.,,
1484,"[…]  I knovv he hath, or you, vvhom I knovv to be all Goodneſs and Honour, vvould not, after the many kind and tender Things I have heard you ſay of this poor helpleſs Child, have ſo diſdainfully called him Fellovv.",fellow,noun,15,"A worthless person; a churl, a knave; also, used as a term of address to a person regarded as such. ",,
2286,"As a teenager, I laid down the sword and decided I wanted to be a disc jockey.  […]  I'd sit outside the studio and watch with envy and admiration as the jocks performed in the small room on the other side of the soundproof window  […]",jock,noun,8,A disc jockey.,,
4395,"You could also add that seat belts, baby seats, and helmets are worthless if you're a totally incompetent turdmuffin that is a danger to yourself and others.",turdmuffin,noun,1,An obnoxious or contemptible person.,,
3610,They assisted us against the Thebans when you shrank from the task.,shrink,verb,5,"To withdraw or retire, as from danger.",,
3771,"The girl did not look like a slore, she looked fairly wholesome in every other regard.",slore,noun,1,A very sexually promiscuous person.,,
4539,I say almost because I could still hear Ted trying his best to wet blanket Webster's Halloween costume idea.,wet blanket,verb,1,Alternative form of wet-blanket,,
2814,The tenant owed a variety of obligations to his overlord—usually including military service or serjeanty—but these were gradually converted into monetary rents.,overlord,noun,2,"A feudal lord directly owed rent or personal service by a tenant of subinfeudated land, a tenant's liege lord.",,
4502,Tommy says he's a NEET at 30 who never worked a day in his life and loves it; a total wasteman if I ever saw one.,wasteman,noun,2,"A loser, bum,  degenerate; someone who wastes their life in some manner.",,
3263,"And, further, let us ſuppoſe, that your King is at Liberty to attack his Pawns upon one Side of the Board, by reckoning how many moves it will take your King to march and take thoſe two Pawns, and alſo, by adding the Number of Moves, which will be neceſſary for you to make a Queen with one of your Pawns: You will, by this Method, find out the exact number of Moves, before you can make a Queen.",queen,noun,5,Referring to one of several items used in tabletop games:,,
1496,The whole notion of sexual harassment is a lie concocted by the fembitches.,fembitch,noun,1,"An intolerant feminist, often used by anti-feminists to refer to a feminist in general.",,
2121,In the afternoon they went to a neighbouring livery stables to look for hirellings.,hireling,noun,3,A horse for hire.,,
3981,"But the Jays were square again by the end of the inning, as Myers hit a 2-and-0 pitch into the left-center field seats",square,adjective,6,Even; tied,,
4150,I never thought I'd meet a girl like you / With auburn hair and tawny eyes,tawny,adjective,1,Of a light brown to brownish orange colour.,,
1708,"Ye greedy ged, ye have taken the very breath out o' me.",gad,noun,2,A greedy and/or stupid person.,,
2652,The notion that he forgot something nagged him the rest of the day.,nag,verb,2,To bother with persistent thoughts or memories.,,
